{
  "aggregated_by_condition": {
    "+importance": {
      "cost": {
        "estimated_cost_usd": {
          "max": 0.0,
          "mean": 0.0,
          "min": 0.0,
          "n": 3,
          "stdev": 0.0
        },
        "total_input_tokens": {
          "max": 31402.0,
          "mean": 30739.333333,
          "min": 30408.0,
          "n": 3,
          "stdev": 468.576094
        },
        "total_output_tokens": {
          "max": 4009.0,
          "mean": 3849.666667,
          "min": 3770.0,
          "n": 3,
          "stdev": 112.66568
        },
        "wall_clock_seconds": {
          "max": 195.47,
          "mean": 159.351333,
          "min": 130.294,
          "n": 3,
          "stdev": 27.072428
        }
      },
      "diagnostic_deltas_vs_measured_baseline": {
        "interview_reflection_mean": {
          "max": 0.0,
          "mean": 0.0,
          "min": 0.0,
          "n": 3,
          "stdev": 0.0
        },
        "membench_factual_mean": {
          "max": 0.0,
          "mean": 0.0,
          "min": 0.0,
          "n": 3,
          "stdev": 0.0
        },
        "membench_reflective_mean": {
          "max": 0.0,
          "mean": 0.0,
          "min": 0.0,
          "n": 3,
          "stdev": 0.0
        }
      },
      "dispersion": {
        "final_round_support_stdev": {
          "max": 0.049216,
          "mean": 0.04381,
          "min": 0.032998,
          "n": 3,
          "stdev": 0.007645
        }
      },
      "run_count": 3,
      "runs": [
        {
          "cost": {
            "estimated_cost_usd": 0.0,
            "importance_scoring_token_totals": {
              "input_tokens": 4775,
              "output_tokens": 895
            },
            "reflection_token_totals": null,
            "total_input_tokens": 30408,
            "total_output_tokens": 3770,
            "wall_clock_seconds": 152.29,
            "weighted_retrieval_embed_api_calls": null
          },
          "deltas_vs_baseline": {
            "interview_category_means": {
              "memory_retrieval": -0.666667,
              "planning": 0.0,
              "reaction": -0.666666,
              "reflection": 0.0,
              "self_knowledge": 0.0
            },
            "membench_factual_mean": 0.0,
            "membench_reflective_mean": 0.0,
            "memory_exclusion_breakdown": {
              "char_budget_truncated": 0,
              "included_clean": 17,
              "network_filtered": 0,
              "recency_cut": -1,
              "same_round_peer": -15,
              "visibility_policy": -10
            },
            "memory_group_addressed_proportion": 0.0
          },
          "dispersion": {
            "final_round_support_levels": [
              0.55,
              0.62,
              0.5
            ],
            "final_round_support_stdev": 0.049216,
            "interview_agent_category_means": {
              "middle_manager_001_001": {
                "memory_retrieval": 1.0,
                "planning": 2.0,
                "reaction": 0.0,
                "reflection": 2.0,
                "self_knowledge": 2.0
              },
              "principal_001_000": {
                "memory_retrieval": 1.0,
                "planning": 2.0,
                "reaction": 1.0,
                "reflection": 2.0,
                "self_knowledge": 2.0
              },
              "teacher_001_002": {
                "memory_retrieval": 2.0,
                "planning": 2.0,
                "reaction": 1.0,
                "reflection": 2.0,
                "self_knowledge": 2.0
              }
            },
            "interview_category_stdev_across_agents": {
              "memory_retrieval": 0.471405,
              "planning": 0.0,
              "reaction": 0.471405,
              "reflection": 0.0,
              "self_knowledge": 0.0
            }
          },
          "metrics": {
            "interview_category_means": {
              "memory_retrieval": 1.333333,
              "planning": 2.0,
              "reaction": 0.666667,
              "reflection": 2.0,
              "self_knowledge": 2.0
            },
            "membench_factual_mean": 1.0,
            "membench_reflective_mean": 1.0,
            "memory_exclusion_breakdown": {
              "char_budget_truncated": 0,
              "included_clean": 60,
              "network_filtered": 0,
              "recency_cut": 20,
              "same_round_peer": 0,
              "visibility_policy": 0
            },
            "memory_group_addressed_proportion": 0.666667,
            "memory_included_clean": 60,
            "memory_recency_cut": 20
          },
          "seed": 42,
          "simulation_id": "78594ff2bc0243bb930abeba1eae9ca4",
          "wall_clock_seconds": 152.29
        },
        {
          "cost": {
            "estimated_cost_usd": 0.0,
            "importance_scoring_token_totals": {
              "input_tokens": 4775,
              "output_tokens": 895
            },
            "reflection_token_totals": null,
            "total_input_tokens": 30408,
            "total_output_tokens": 3770,
            "wall_clock_seconds": 130.294,
            "weighted_retrieval_embed_api_calls": null
          },
          "deltas_vs_baseline": {
            "interview_category_means": {
              "memory_retrieval": -0.333333,
              "planning": 0.0,
              "reaction": -0.666666,
              "reflection": 0.0,
              "self_knowledge": 0.0
            },
            "membench_factual_mean": 0.0,
            "membench_reflective_mean": 0.0,
            "memory_exclusion_breakdown": {
              "char_budget_truncated": 0,
              "included_clean": 17,
              "network_filtered": 0,
              "recency_cut": -1,
              "same_round_peer": -15,
              "visibility_policy": -10
            },
            "memory_group_addressed_proportion": 0.0
          },
          "dispersion": {
            "final_round_support_levels": [
              0.55,
              0.62,
              0.5
            ],
            "final_round_support_stdev": 0.049216,
            "interview_agent_category_means": {
              "middle_manager_001_001": {
                "memory_retrieval": 2.0,
                "planning": 2.0,
                "reaction": 0.0,
                "reflection": 2.0,
                "self_knowledge": 2.0
              },
              "principal_001_000": {
                "memory_retrieval": 1.0,
                "planning": 2.0,
                "reaction": 1.0,
                "reflection": 2.0,
                "self_knowledge": 2.0
              },
              "teacher_001_002": {
                "memory_retrieval": 2.0,
                "planning": 2.0,
                "reaction": 1.0,
                "reflection": 2.0,
                "self_knowledge": 2.0
              }
            },
            "interview_category_stdev_across_agents": {
              "memory_retrieval": 0.471405,
              "planning": 0.0,
              "reaction": 0.471405,
              "reflection": 0.0,
              "self_knowledge": 0.0
            }
          },
          "metrics": {
            "interview_category_means": {
              "memory_retrieval": 1.666667,
              "planning": 2.0,
              "reaction": 0.666667,
              "reflection": 2.0,
              "self_knowledge": 2.0
            },
            "membench_factual_mean": 1.0,
            "membench_reflective_mean": 1.0,
            "memory_exclusion_breakdown": {
              "char_budget_truncated": 0,
              "included_clean": 60,
              "network_filtered": 0,
              "recency_cut": 20,
              "same_round_peer": 0,
              "visibility_policy": 0
            },
            "memory_group_addressed_proportion": 0.666667,
            "memory_included_clean": 60,
            "memory_recency_cut": 20
          },
          "seed": 43,
          "simulation_id": "a9b0e56afc8541ae9d2e26081396ae7d",
          "wall_clock_seconds": 130.294
        },
        {
          "cost": {
            "estimated_cost_usd": 0.0,
            "importance_scoring_token_totals": {
              "input_tokens": 5006,
              "output_tokens": 903
            },
            "reflection_token_totals": null,
            "total_input_tokens": 31402,
            "total_output_tokens": 4009,
            "wall_clock_seconds": 195.47,
            "weighted_retrieval_embed_api_calls": null
          },
          "deltas_vs_baseline": {
            "interview_category_means": {
              "memory_retrieval": 0.0,
              "planning": 0.0,
              "reaction": -1.0,
              "reflection": 0.0,
              "self_knowledge": 0.0
            },
            "membench_factual_mean": 0.0,
            "membench_reflective_mean": 0.0,
            "memory_exclusion_breakdown": {
              "char_budget_truncated": 0,
              "included_clean": 17,
              "network_filtered": 0,
              "recency_cut": -1,
              "same_round_peer": -15,
              "visibility_policy": -10
            },
            "memory_group_addressed_proportion": 0.0
          },
          "dispersion": {
            "final_round_support_levels": [
              0.55,
              0.62,
              0.55
            ],
            "final_round_support_stdev": 0.032998,
            "interview_agent_category_means": {
              "middle_manager_001_001": {
                "memory_retrieval": 2.0,
                "planning": 2.0,
                "reaction": 0.0,
                "reflection": 2.0,
                "self_knowledge": 2.0
              },
              "principal_001_000": {
                "memory_retrieval": 2.0,
                "planning": 2.0,
                "reaction": 0.0,
                "reflection": 2.0,
                "self_knowledge": 2.0
              },
              "teacher_001_002": {